### ISSUE TITLE
think about multiple packages

### ISSUE THREAD

**Issue by ChillerDragon** [ChillerDragon/teeworlds-web-traffic-decoder#2]
, or empty line separated? Multiple api calls?

Pasting in a wall of tcpdump and getting all packets back would be nice

**Comment by ChillerDragon** [comment]
It should split in js and then create multiple output boxes and multiple api calls. And only refresh those that got updated.
Too complex?

**Comment by ChillerDragon** [comment]
```
03:11:31.093734 IP6 localhost.55752 > localhost.8303: UDP, length 21
        0x0000:  6004 33b1 001d 1140 0000 0000 0000 0000  `.3....@........
        0x0010:  0000 0000 0000 0001 0000 0000 0000 0000  ................
        0x0020:  0000 0000 0000 0001 d9c8 206f 001d 0030  ...........o...0
        0x0030:  100f 0126 3e5a 3755 e948 e767 e7cc cf6e  ...&>Z7U.H.g...n
        0x0040:  8dff 10c5 0d                             .....
03:11:31.106564 IP6 localhost.8303 > localhost.55752: UDP, length 21
        0x0000:  600a a56d 001d 1140 0000 0000 0000 0000  `..m...@........
        0x0010:  0000 0000 0000 0001 0000 0000 0000 0000  ................
        0x0020:  0000 0000 0000 0001 206f d9c8 001d 0030  .........o.....0
        0x0030:  0019 0223 ec92 0300 0515 9ea0 050c 0005  ...#............
        0x0040:  0f9e a005 02                             .....
03:11:31.128677 IP6 localhost.55752 > localhost.8303: UDP, length 8
        0x0000:  6004 33b1 0010 1140 0000 0000 0000 0000  `.3....@........
        0x0010:  0000 0000 0000 0001 0000 0000 0000 0000  ................
        0x0020:  0000 0000 0000 0001 d9c8 206f 0010 0023  ...........o...#
        0x0030:  040f 0026 3e5a 3704                      ...&>Z7.
```

**Comment by ChillerDragon** [comment]
Ok it now only splits for tcpdumps and on nothing else and supports up to 20 of them. And does it in sequential api calls.
